,description,url,Breed,Age,Price
0,Fantastiski skaistas māsiņas gaida savu saimniеku. Pusgarspalvainās šinšilas krāsojuma mJelgava and reg.,https://ss.com/msg/en/animals/cats/british-shorthair/fxdep.html,British shorthair,6 mon.,200  €
1,"Великолепная красавица Мия ищет дом. Девочка здорова, стерилизована, вакцинирована. Она Riga",https://ss.com/msg/en/animals/cats/neva-masquerade/enjle.html,Neva masquerade,18 mon.,50  €
2,"Ļoti maigs, sirsnīgs, roku donas sfinksa zēns. Velūra, balta tīģera krāsā. Pirmā pote. Riga",https://ss.com/msg/en/animals/cats/don-sphynx/dkbcx.html,Don sphynx,3 mon.,330  €
3,"Предлагаются 2 ориентальные девочки , окрас черный и шоколадный. Характер ласковый. ПривRiga",https://ss.com/msg/en/animals/cats/oriental/fhfbb.html,Oriental,6 mon.,300  €
4,"Ir pieejams adopcijai melns ar pelēku vēderiņu, garspalvains, mīļš, rotaļīgs runčukus. TRiga district",https://ss.com/msg/en/animals/cats/outbred/cxpekm.html,Outbred,1.3 mon.,-
5,"Ļoti mīļš un aktīvs blēņdaris skaistulis Rudolfs meklē atbildīgu saimnieku. 
Rudim apmēRiga",https://ss.com/msg/en/animals/cats/outbred/jiinb.html,Outbred,3 years,30  €
6,"Ļoti mīļa un rotaļīga skaistule Lapočka meklē labas mājas un atbildīgu saimnieku. 
LapoRiga",https://ss.com/msg/en/animals/cats/outbred/jffcn.html,Outbred,1 years,30  €
7,"Ļoti mīļš un aktīvs smukulis strīpainais Risja meklē atbildīgu saimnieku. 
Runcītim apmRiga",https://ss.com/msg/en/animals/cats/outbred/incek.html,Outbred,3 years,30  €
8,Ļoti mīļš gļēvulis garspalvainais skaistulis senjors Barsiks meklē jaunu mierīgu ģimeni.Riga,https://ss.com/msg/en/animals/cats/outbred/jgigb.html,Outbred,8 years,30  €
9,"Lv/rus
Skaistule Lota ar smuku trīskrāsu kažociņu ir aktīva, ziņkārīga, bet vel nedaudzRiga",https://ss.com/msg/en/animals/cats/outbred/jhogk.html,Outbred,1 years,20  €
10,Domino ir ļoti smuks un mīļš mājas mincis. Runčuks bija atrasts mazdārziņos ļoti slims. Riga,https://ss.com/msg/en/animals/cats/outbred/jinkx.html,Outbred,4 years,20  €
11,"Lv/rus
Mierīgs, zolīdz kaķu kungs Sjoma palicis bez sava mīļā saimnieka. Runcīs ilgi pāRiga",https://ss.com/msg/en/animals/cats/outbred/kepcd.html,Outbred,6 years,20  €
12,Ļoti mīļš un smuks strīpainītis Edijs bija pieklīdis pie kāda celtniecības objekta un dzRiga,https://ss.com/msg/en/animals/cats/outbred/dkcoc.html,Outbred,1 years,30  €
13,"Mīļa, gudra, mierīgā Pele bija izmesta no mājām un visu savu mūžu izdzīvoja pamestas rūpRiga",https://ss.com/msg/en/animals/cats/outbred/doiho.html,Outbred,5 years,20  €
14,"Mīļa smukule Momo meklē atbildīgu saimnieku. 
Kaķenītei 5 mēneši. 
Momo ir vakcinēta, Riga",https://ss.com/msg/en/animals/cats/outbred/odxob.html,Outbred,5 mon.,30  €
15,"Trīs britu īsspalvainie kaķēni, visi puikas, meklē gādīgus saimniekus. Dzimuši 18.08.202Preili and reg.",https://ss.com/msg/en/animals/cats/british-shorthair/bghodl.html,British shorthair,2 mon.,180  €
16,"Atdodam savu mīļo, raibo runčuku 7 mēn. vecu. 
Diemžēl nevaram paturēt paši, sakārā ar Riga",https://ss.com/msg/en/animals/cats/unknown-breed/fnmmm.html,Unknown breed,7 mon.,5  €
17,"Маленькая Белочка ищет дом. Девочка, котенком, пришла на огороды, люди ее подкармливали Riga",https://ss.com/msg/en/animals/cats/outbred/jjbnl.html,Outbred,12 mon.,50  €
18,"Ļoti skaista meinkuna meitene , zila ar bešu, ar ļoti jauko raksturu, komunikabla, aktīvDaugavpils and reg.",https://ss.com/msg/en/animals/cats/maine-coon/blbiek.html,Maine coon,2 mon.,700  €
19,"Fantastiski kaķēni meklē mīlošus un atbildīgus saimniekus. 
Mazie kārtīgi, ar labām manRiga",https://ss.com/msg/en/animals/cats/outbred/jbbce.html,Outbred,3 mon.,20  €
20,"Готовы к переезду в вашу семью котята ориентальной породы. Color point мальчик, белый маRiga",https://ss.com/msg/en/animals/cats/oriental/bgbegf.html,Oriental,2 mon.,400  €
21,"Невероятно ласковый, скромный, с глазами, приникающими в самое сердце, малыш Френк ищет Riga",https://ss.com/msg/en/animals/cats/outbred/cgcop.html,Outbred,12 mon.,20  €
22,"Малышка Лаки очень срочно ищет дом. Засиделась она во временном доме. Девочка скромная, Riga",https://ss.com/msg/en/animals/cats/outbred/iolld.html,Outbred,18 mon.,20  €
23,"Шикарная красавица Луна, ищет дом. Девочка ласковая, спокойная. Отглистована, стерилизовRiga",https://ss.com/msg/en/animals/cats/outbred/fpnfx.html,Outbred,2 years,20  €
24,"Яркий красавец Марчелло ищет дом. Малыш очень ласковый, к порядку приучен, с другими котRiga",https://ss.com/msg/en/animals/cats/outbred/jjmlx.html,Outbred,12 mon.,20  €
25,"Малышка Мелисса, с родиной на щечке, ищет дом. 
Девочка очень ласковая, к порядку приучRiga",https://ss.com/msg/en/animals/cats/outbred/kiopp.html,Outbred,6 mon.,20  €
26,"Два тигренка, братик и сестричка, ищут дом. Детки ласковые, здоровы, лоток 5+, вакцинироRiga",https://ss.com/msg/en/animals/cats/outbred/jxhmm.html,Outbred,6 mon.,20  €
27,"Шикарная белая красавица, по имени Снежка, ищет дом. Мега ласковая девочка скучает во врRiga",https://ss.com/msg/en/animals/cats/outbred/iolml.html,Outbred,5 years,20  €
28,"Sveicināti, vai šie skaistie skaistuļi neiekrīt actiņās, 2 meitenītes un viens puika , 6Riga",https://ss.com/msg/en/animals/cats/outbred/cxphmd.html,Outbred,6 mon.,-
29,"Super puisītis skotu ""highland strait"" sudrabota krāsa, 2 mēn. Ļoti mīlīgs, vesels, kārtRiga",https://ss.com/msg/en/animals/cats/scottish-fold/bejkcj.html,Scottish fold,2 mon.,140  €
